num,name,slug,desc
256,Neutralizing Gas,neutralizinggas,"While the Pokémon is in the battle, the effects of all other Pokémon's Abilities will be nullified or will not be triggered."
257,Pastel Veil,pastelveil,Prevents the Pokémon and its allies from being poisoned.
258,Hunger Switch,hungerswitch,"The Pokémon changes its form, alternating between its Full Belly Mode and Hangry Mode after the end of every turn."
259,Quick Draw,quickdraw,Enables the Pokémon to move first occasionally.
260,Unseen Fist,unseenfist,"If the Pokémon uses moves that make direct contact, it can attack the target even if the target protects itself."
261,Curious Medicine,curiousmedicine,"When the Pokémon enters a battle, it scatters medicine from its shell, which removes all stat changes from allies."
262,Transistor,transistor,Powers up Electric-type moves.
263,Dragon's Maw,dragonsmaw,Powers up Dragon-type moves.
264,Chilling Neigh,chillingneigh,"When the Pokémon knocks out a target, it utters a chilling neigh, which boosts its Attack stat."
265,Grim Neigh,grimneigh,"When the Pokémon knocks out a target, it utters a terrifying neigh, which boosts its Sp. Atk stat."
266,As One,asoneglastrier,This Ability combines the effects of both Calyrex's Unnerve Ability and Glastrier's Chilling Neigh Ability.
267,As One,asonespectrier,This Ability combines the effects of both Calyrex's Unnerve Ability and Spectrier's Grim Neigh Ability.
268,Lingering Aroma,lingeringaroma,Contact with the Pokémon changes the attacker's Ability to Lingering Aroma.
269,Seed Sower,seedsower,Turns the ground into Grassy Terrain when the Pokémon is hit by an attack.
270,Thermal Exchange,thermalexchange,Boosts the Attack stat when the Pokémon is hit by a Fire-type move. The Pokémon also cannot be burned.
271,Anger Shell,angershell,"When an attack causes its HP to drop to half or less, the Pokémon gets angry. This lowers its Defense and Sp. Def stats but boosts its Attack, Sp. Atk, and Speed stats."
272,Purifying Salt,purifyingsalt,The Pokémon's pure salt protects it from status conditions and halves the damage taken from Ghost-type moves.
273,Well-Baked Body,wellbakedbody,"The Pokémon takes no damage when hit by Fire-type moves. Instead, its Defense stat is sharply boosted."
274,Wind Rider,windrider,Boosts the Pokémon's Attack stat if Tailwind takes effect or if the Pokémon is hit by a wind move. The Pokémon also takes no damage from wind moves.
275,Guard Dog,guarddog,Boosts the Pokémon's Attack stat if intimidated. Moves and items that would force the Pokémon to switch out also fail to work.
276,Rocky Payload,rockypayload,Powers up Rock-type moves.
277,Wind Power,windpower,"The Pokémon becomes charged when it is hit by a wind move, boosting the power of the next Electric-type move the Pokémon uses."
278,Zero to Hero,zerotohero,The Pokémon transforms into its Hero Form when it switches out.
279,Commander,commander,"When the Pokémon enters a battle, it goes inside the mouth of an ally Dondozo if one is on the field. The Pokémon then issues commands from there."
280,Electromorphosis,electromorphosis,"The Pokémon becomes charged when it takes damage, boosting the power of the next Electric-type move the Pokémon uses."
281,Protosynthesis,protosynthesis,Boosts the Pokémon's most proficient stat in harsh sunlight or if the Pokémon is holding Booster Energy.
282,Quark Drive,quarkdrive,Boosts the Pokémon's most proficient stat on Electric Terrain or if the Pokémon is holding Booster Energy.
283,Good as Gold,goodasgold,"A body of pure, solid gold gives the Pokémon full immunity to other Pokémon's status moves."
284,Vessel of Ruin,vesselofruin,The power of the Pokémon's ruinous vessel lowers the Sp. Atk stats of all Pokémon except itself.
285,Sword of Ruin,swordofruin,The power of the Pokémon's ruinous sword lowers the Defense stats of all Pokémon except itself.
286,Tablets of Ruin,tabletsofruin,The power of the Pokémon's ruinous wooden tablets lowers the Attack stats of all Pokémon except itself.
287,Beads of Ruin,beadsofruin,The power of the Pokémon's ruinous beads lowers the Sp. Def stats of all Pokémon except itself.
288,Orichalcum Pulse,orichalcumpulse,Turns the sunlight harsh when the Pokémon enters a battle. The ancient pulse thrumming through the Pokémon also boosts its Attack stat in harsh sunlight.
289,Hadron Engine,hadronengine,Turns the ground into Electric Terrain when the Pokémon enters a battle. The futuristic engine within the Pokémon also boosts its Sp. Atk stat on Electric Terrain.
290,Opportunist,opportunist,"If an opponent's stat is boosted, the Pokémon seizes the opportunity to boost the same stat for itself."
291,Cud Chew,cudchew,"When the Pokémon eats a Berry, it will regurgitate that Berry at the end of the next turn and eat it one more time."
292,Sharpness,sharpness,Powers up slicing moves.
293,Supreme Overlord,supremeoverlord,"When the Pokémon enters a battle, its Attack and Sp. Atk stats are slightly boosted for each of the allies in its party that have already been defeated."
294,Costar,costar,"When the Pokémon enters a battle, it copies an ally's stat changes."
295,Toxic Debris,toxicdebris,Scatters poison spikes at the feet of the opposing team when the Pokémon takes damage from physical moves.
296,Armor Tail,armortail,The mysterious tail covering the Pokémon's head makes opponents unable to use priority moves against the Pokémon or its allies.
297,Earth Eater,eartheater,"If hit by a Ground-type move, the Pokémon has its HP restored instead of taking damage."
298,Mycelium Might,myceliummight,"The Pokémon will always act more slowly when using status moves, but these moves will be unimpeded by the Ability of the target."
299,Hospitality,hospitality,"When the Pokémon enters a battle, it showers its ally with hospitality, restoring a small amount of the ally's HP."
300,Mind's Eye,mindseye,"The Pokémon ignores changes to opponents' evasiveness, its accuracy can't be lowered, and it can hit Ghost types with Normal- and Fighting-type moves."
301,Embody Aspect,embodyaspectteal,"The Pokémon's heart fills with memories, causing the Teal Mask to shine and the Pokémon's Speed stat to be boosted."
302,Embody Aspect,embodyaspecthearthflame,"The Pokémon's heart fills with memories, causing the Hearthflame Mask to shine and the Pokémon's Attack stat to be boosted."
303,Embody Aspect,embodyaspectwellspring,"The Pokémon's heart fills with memories, causing the Wellspring Mask to shine and the Pokémon's Sp. Def stat to be boosted."
304,Embody Aspect,embodyaspectcornerstone,"The Pokémon's heart fills with memories, causing the Cornerstone Mask to shine and the Pokémon's Defense stat to be boosted."
305,Toxic Chain,toxicchain,The power of the Pokémon's toxic chain may badly poison any target the Pokémon hits with a move.
306,Supersweet Syrup,supersweetsyrup,"A sickly sweet scent spreads across the field the first time the Pokémon enters a battle, lowering the evasiveness of opposing Pokémon."
307,Tera Shift,terashift,"When the Pokémon enters a battle, it absorbs the energy around itself and transforms into its Terastal Form."
308,Tera Shell,terashell,The Pokémon's shell contains the powers of each type. All damage-dealing moves that hit the Pokémon when its HP is full will not be very effective.
309,Teraform Zero,teraformzero,"When Terapagos changes into its Stellar Form, it uses its hidden powers to eliminate all effects of weather and terrain, reducing them to zero."
310,Poison Puppeteer,poisonpuppeteer,Pokémon poisoned by Pecharunt's moves will also become confused.
